[
  {
    "id": "FR-001",
    "title": "予約登録機能",
    "description": "顧客がユーザー登録なしでオンライン予約を登録できる機能。日時選択、サービスメニュー選択、顧客情報入力、予約確定、予約番号発行までの一連の流れを提供する。ユーザー登録やログインは不要で、予約ごとに顧客情報を入力する。",
    "type": "functional",
    "category": "予約管理",
    "priority": "critical",
    "status": "proposed",
    "rationale": "顧客が24時間いつでも手軽に予約できることがシステムの中核機能。ユーザー登録を不要とすることで、予約のハードルを下げ、顧客の利便性を最大化する。",
    "acceptanceCriteria": [
      "ユーザー登録・ログインなしで予約できること",
      "予約完了までの操作時間が3分以内であること",
      "入力エラーが即座に表示されること",
      "予約番号が即座に発行されること",
      "予約データがデータベースに正しく保存されること",
      "ダブルブッキングが発生しないこと"
    ],
    "dependencies": [],
    "relatedRequirements": ["FR-004", "NFR-001", "NFR-003"],
    "stakeholders": ["SH-CUSTOMER", "SH-STAFF"],
    "metrics": {
      "targetValue": "3分以内",
      "unit": "分"
    },
    "implementationNotes": "カレンダーUIライブラリの選定が必要。リアルタイムで空き状況を確認するため、Websocketまたはポーリングの検討が必要。トランザクション管理を徹底し、同時アクセス時のダブルブッキングを防止すること。",
    "testCases": ["TC-FR-001-01", "TC-FR-001-02", "TC-FR-001-03"],
    "estimatedEffort": {
      "value": 40,
      "unit": "hours"
    }
  },
  {
    "id": "FR-001-01",
    "title": "日時選択（カレンダーUIで空き状況表示）",
    "description": "顧客がカレンダーUIから予約希望日時を選択する。空き枠は選択可能、満席の枠は選択不可として視覚的に区別表示する。",
    "type": "functional",
    "category": "予約登録",
    "priority": "critical",
    "status": "proposed",
    "rationale": "空き状況を視覚的に確認できることで、顧客の利便性が向上し、予約完了率が高まる。",
    "acceptanceCriteria": [
      "カレンダーUIが表示されること",
      "空き枠と満席枠が視覚的に区別されていること",
      "選択した日時が確認画面に正しく反映されること",
      "過去の日時は選択できないこと"
    ],
    "dependencies": ["FR-004"],
    "relatedRequirements": ["NFR-001"],
    "stakeholders": ["SH-CUSTOMER"],
    "implementationNotes": "レスポンシブ対応のカレンダーライブラリを使用。モバイルでもタップしやすいUI設計が必要。",
    "estimatedEffort": {
      "value": 12,
      "unit": "hours"
    }
  },
  {
    "id": "FR-001-02",
    "title": "サービスメニュー選択（複数選択可）",
    "description": "顧客が利用したいサービスメニューを選択する。複数サービスの同時選択が可能で、所要時間が自動計算される。",
    "type": "functional",
    "category": "予約登録",
    "priority": "high",
    "status": "proposed",
    "rationale": "複数サービスの同時予約を可能にすることで、顧客の利便性が向上する。",
    "acceptanceCriteria": [
      "サービスメニュー一覧が表示されること",
      "複数サービスの選択が可能であること",
      "選択したサービスの合計所要時間が表示されること",
      "所要時間に応じて終了予定時刻が計算されること"
    ],
    "dependencies": ["FR-004"],
    "relatedRequirements": [],
    "stakeholders": ["SH-CUSTOMER"],
    "implementationNotes": "サービスマスタから所要時間を取得し、合計時間を計算する。",
    "estimatedEffort": {
      "value": 8,
      "unit": "hours"
    }
  },
  {
    "id": "FR-001-03",
    "title": "顧客情報入力",
    "description": "顧客が氏名、電話番号、メールアドレス、特記事項を入力する。必須項目と任意項目を明示し、入力形式を検証する。",
    "type": "functional",
    "category": "予約登録",
    "priority": "high",
    "status": "proposed",
    "rationale": "正確な顧客情報の収集は、予約管理と顧客対応に不可欠。",
    "acceptanceCriteria": [
      "氏名、電話番号、メールアドレスが必須項目として表示されること",
      "特記事項が任意項目として表示されること",
      "メールアドレスの形式が検証されること",
      "電話番号の形式が検証されること",
      "入力エラーが即座に表示されること"
    ],
    "dependencies": [],
    "relatedRequirements": ["NFR-003"],
    "stakeholders": ["SH-CUSTOMER", "SH-STAFF"],
    "implementationNotes": "クライアント側とサーバー側の両方でバリデーションを実施。個人情報は暗号化して保存。",
    "estimatedEffort": {
      "value": 10,
      "unit": "hours"
    }
  },
  {
    "id": "FR-001-04",
    "title": "入力内容の確認画面表示",
    "description": "予約確定前に、顧客が入力した全内容（日時、サービス、顧客情報）を一覧表示し、確認を促す。",
    "type": "functional",
    "category": "予約登録",
    "priority": "medium",
    "status": "proposed",
    "rationale": "確認画面を提供することで、入力ミスによる誤予約を防止できる。",
    "acceptanceCriteria": [
      "全入力内容が見やすく表示されること",
      "「戻る」ボタンで前画面に戻れること",
      "「確定」ボタンで予約が確定されること"
    ],
    "dependencies": ["FR-001-01", "FR-001-02", "FR-001-03"],
    "relatedRequirements": ["NFR-004"],
    "stakeholders": ["SH-CUSTOMER"],
    "implementationNotes": "モバイルでもスクロールなしで全内容が確認できるレイアウトにする。",
    "estimatedEffort": {
      "value": 5,
      "unit": "hours"
    }
  },
  {
    "id": "FR-001-05",
    "title": "予約確定処理",
    "description": "顧客が確定ボタンをクリックした際に、予約データをデータベースに保存し、予約枠を確保する。トランザクション管理により、ダブルブッキングを防止する。",
    "type": "functional",
    "category": "予約登録",
    "priority": "critical",
    "status": "proposed",
    "rationale": "予約の信頼性を確保するため、トランザクション管理は必須。",
    "acceptanceCriteria": [
      "予約データが正しくデータベースに保存されること",
      "同時アクセス時でもダブルブッキングが発生しないこと",
      "予約確定に失敗した場合はエラーメッセージが表示されること",
      "トランザクションがロールバックされること"
    ],
    "dependencies": ["FR-001-04"],
    "relatedRequirements": ["NFR-001", "NFR-002", "NFR-003"],
    "stakeholders": ["SH-CUSTOMER", "SH-STAFF"],
    "implementationNotes": "楽観的ロックまたは悲観的ロックを実装。同時アクセス時のロック競合を考慮したエラーハンドリングが必要。",
    "estimatedEffort": {
      "value": 15,
      "unit": "hours"
    }
  },
  {
    "id": "FR-001-06",
    "title": "予約番号の発行と表示",
    "description": "予約確定後、一意の予約番号を生成し、顧客に表示する。予約番号は予約の変更・キャンセル時の識別に使用される。",
    "type": "functional",
    "category": "予約登録",
    "priority": "high",
    "status": "proposed",
    "rationale": "予約番号は予約の識別と管理に不可欠。顧客が簡単に記録・参照できる形式が必要。",
    "acceptanceCriteria": [
      "予約番号が一意に生成されること",
      "予約番号が予約完了画面に表示されること",
      "予約番号が8-12桁の英数字であること",
      "予約番号がデータベースに保存されること"
    ],
    "dependencies": ["FR-001-05"],
    "relatedRequirements": ["FR-002"],
    "stakeholders": ["SH-CUSTOMER", "SH-STAFF"],
    "implementationNotes": "UUID、または日付+連番のハイブリッド形式を検討。読みやすさと一意性のバランスが重要。",
    "estimatedEffort": {
      "value": 5,
      "unit": "hours"
    }
  },
  {
    "id": "FR-002",
    "title": "予約変更・キャンセル機能",
    "description": "顧客が登録済み予約を変更またはキャンセルできる機能。予約番号を入力することで予約を特定し、その予約番号を持つ者に変更・キャンセルの権限を認可する。予約番号が認証トークンとして機能し、ログイン不要で操作可能。",
    "type": "functional",
    "category": "予約管理",
    "priority": "high",
    "status": "proposed",
    "rationale": "予約の変更・キャンセル機能は顧客の利便性向上に不可欠。予約番号による認可により、ログイン不要で安全に予約を管理できる。",
    "acceptanceCriteria": [
      "予約番号のみで予約を検索・認可できること",
      "予約番号が一致した場合のみ変更・キャンセルが可能であること",
      "予約内容を表示できること",
      "日時やサービスを変更できること",
      "予約をキャンセルできること",
      "変更・キャンセル期限を過ぎた予約は操作できないこと",
      "キャンセル期限内であればワンクリックでキャンセル可能であること",
      "変更完了後、即座に更新が反映されること"
    ],
    "dependencies": ["FR-001"],
    "relatedRequirements": ["NFR-001"],
    "stakeholders": ["SH-CUSTOMER", "SH-STAFF"],
    "metrics": {
      "targetValue": "即座に反映",
      "unit": "秒"
    },
    "implementationNotes": "変更・キャンセル期限は店舗側で設定可能にする。キャンセル時は予約枠を即座に解放し、他の顧客が予約できるようにする。",
    "testCases": ["TC-FR-002-01", "TC-FR-002-02", "TC-FR-002-03"],
    "estimatedEffort": {
      "value": 30,
      "unit": "hours"
    }
  },
  {
    "id": "FR-002-01",
    "title": "予約確認（予約番号で検索・認可）",
    "description": "顧客が予約番号を入力して、既存の予約を検索・表示する。予約番号の入力により、その予約の変更・キャンセル権限が認可される。予約番号が認証トークンとして機能する。",
    "type": "functional",
    "category": "予約変更・キャンセル",
    "priority": "high",
    "status": "proposed",
    "rationale": "予約番号による認可は、ログイン不要で安全に予約を管理できる。予約番号を知る者のみが操作可能であり、プライバシー保護にも優れる。",
    "acceptanceCriteria": [
      "予約番号入力フィールドが表示されること",
      "入力された予約番号で予約を検索できること",
      "予約が見つかった場合、予約内容を表示すること",
      "予約番号が一致した場合のみ、変更・キャンセルボタンが有効になること",
      "予約が見つからない場合、エラーメッセージを表示すること"
    ],
    "dependencies": [],
    "relatedRequirements": [],
    "stakeholders": ["SH-CUSTOMER"],
    "implementationNotes": "予約番号の入力形式をバリデーション。検索APIは適切なインデックスを使用して高速化。",
    "estimatedEffort": {
      "value": 8,
      "unit": "hours"
    }
  },
  {
    "id": "FR-002-02",
    "title": "予約内容表示",
    "description": "検索された予約の詳細情報（日時、サービス、顧客情報、ステータス）を表示する。",
    "type": "functional",
    "category": "予約変更・キャンセル",
    "priority": "medium",
    "status": "proposed",
    "rationale": "顧客が現在の予約内容を確認してから変更・キャンセルを判断できるようにする。",
    "acceptanceCriteria": [
      "予約日時が表示されること",
      "サービス内容が表示されること",
      "顧客情報が表示されること",
      "予約ステータスが表示されること",
      "「変更」「キャンセル」ボタンが表示されること"
    ],
    "dependencies": ["FR-002-01"],
    "relatedRequirements": ["NFR-004"],
    "stakeholders": ["SH-CUSTOMER"],
    "implementationNotes": "モバイル表示に最適化したレイアウト。",
    "estimatedEffort": {
      "value": 5,
      "unit": "hours"
    }
  },
  {
    "id": "FR-002-03",
    "title": "日時変更（新しい空き枠から選択）",
    "description": "顧客が予約の日時を変更する。新しい日時をカレンダーUIから選択し、空き状況を確認して変更を確定する。",
    "type": "functional",
    "category": "予約変更・キャンセル",
    "priority": "high",
    "status": "proposed",
    "rationale": "日時変更は顧客のニーズに柔軟に対応するために必要。",
    "acceptanceCriteria": [
      "カレンダーUIが表示されること",
      "新しい日時を選択できること",
      "空き状況が確認できること",
      "変更内容が確認画面に表示されること",
      "確定後、予約データが更新されること",
      "元の予約枠が解放されること"
    ],
    "dependencies": ["FR-002-02", "FR-004"],
    "relatedRequirements": ["NFR-001"],
    "stakeholders": ["SH-CUSTOMER"],
    "implementationNotes": "トランザクション管理により、元の枠の解放と新しい枠の確保を原子的に実行。",
    "estimatedEffort": {
      "value": 12,
      "unit": "hours"
    }
  },
  {
    "id": "FR-002-04",
    "title": "キャンセル処理",
    "description": "顧客が予約をキャンセルする。キャンセル確認後、予約ステータスをキャンセルに更新し、予約枠を解放する。",
    "type": "functional",
    "category": "予約変更・キャンセル",
    "priority": "high",
    "status": "proposed",
    "rationale": "キャンセル機能により、顧客は柔軟に予約を管理できる。",
    "acceptanceCriteria": [
      "キャンセル確認ダイアログが表示されること",
      "確定後、予約ステータスが「キャンセル」に更新されること",
      "予約枠が即座に解放されること",
      "キャンセル期限を過ぎた予約はキャンセルできないこと"
    ],
    "dependencies": ["FR-002-02"],
    "relatedRequirements": [],
    "stakeholders": ["SH-CUSTOMER", "SH-STAFF"],
    "implementationNotes": "キャンセル期限は店舗設定に基づく。キャンセル履歴はログとして保存。",
    "estimatedEffort": {
      "value": 8,
      "unit": "hours"
    }
  },
  {
    "id": "FR-002-05",
    "title": "変更・キャンセル完了画面表示",
    "description": "予約の変更またはキャンセルが完了したことを顧客に通知する画面を表示する。",
    "type": "functional",
    "category": "予約変更・キャンセル",
    "priority": "medium",
    "status": "proposed",
    "rationale": "完了画面により、顧客は操作が正常に完了したことを確認できる。",
    "acceptanceCriteria": [
      "変更完了メッセージが表示されること",
      "キャンセル完了メッセージが表示されること",
      "更新後の予約内容が表示されること（変更の場合）"
    ],
    "dependencies": ["FR-002-03", "FR-002-04"],
    "relatedRequirements": ["NFR-004"],
    "stakeholders": ["SH-CUSTOMER"],
    "implementationNotes": "明確で分かりやすいメッセージ表示。",
    "testCases": []
  },
  {
    "id": "FR-002-06",
    "title": "スタッフログイン機能",